document_id,terms
a700bd,wholesaler distribution authorisation|agility|distribution|uk medicines healthcare|virtual wholesalers
820d93,frankfurt logistics centre|healthcare logistics centre|panalpina charter network|panalpina|frankfurt airport
a8b94f,qatar airways cargo|qatar airways chief officer|qatar airways|dokasch opticooler containers|temperature sensitive cargo
79c94e,new pharma hub|aviapartner cargo|pharma hub|high profile pharma products|aviapartner
fb38a3,schiphol data|critical flower shipment data|amsterdam airport schiphol|shipment data|smart cargo mainport program
dfc7bf,riogaleo cargo terminal|riogaleo cargo|riogaleão cargo|rio de janeiro|cargo
2288cd,worldwide information network|independent freight forwarders|singapore airlines|american airlines|united airlines
42ec6a,cargo cool center|lufthansa cargo board member|lufthansa cargo|temperature-sensitive cargo growth|frankfurt cool center
caedf9,peli biothermal|dublin facility|dublin network station|dublin airport|facility
1ab75d,"25,898 square foot unit|19,192 square foot unit|one 36,116 square foot unit|third segro warehouse|modern specification units"
bea2db,turkish cargo brand|turkish cargo|turkish hub|turkish airlines|ceiv pharma certificate
35ecb5,quick quote app|quick quote|standalone app|news app|individual apps
a831f9,global perishables network|global perishable logistics strategy|perishables network|global perishable sector|k+n international management board
6fc469,planned single warehouse management system|new system|panalpina|system|international customers
e274b8,health care center capacity|health care center|lug team|health care shipments|lug
552d73,airasia x services|airasia x|switzerland-based unilode aviation solutions|airasia|malaysia-based carrier air asia
8cd6b9,new us drop points|eight us return points|credo cargo bulk shippers|credo xtreme pallet shippers|peli biothermal
cdd606,us carrier american airlines cargo|american airlines cargo reefer containers|uld management provider jettainer|american airlines cargo|jettainer
87fc49,first air cargo digital corridor|respective air cargo community systems|digital air freight corridor|air cargo business|kale logistics solutions ceo amar
c01f43,jettainer americas|jettainer|uld management company|new ground operations supervisors|us expansion
69b452,first comprehensive online platform|air cargo trade scenario|air cargo industry|cargo rate discovery|wings india
d873a1,priority freight europe|priority freight group|new german airfreight department|priority freight|new emergency airfreight operations
6e32da,other delta booking channels|delta cargo|digital booking platforms|traditional booking channels|number one global booking channel
55777d,director dhl global forwarding austria|dhl global|vienna pharma centre|dhl|refrigerated warehouse space
bb5214,elite global logistics network|global logistics|first annual conference|first conference|egln members
5fe27c,ups express critical service|ups team|ups capital|express critical service|ups
c6aaab,lufthansa cargo|air cargo industry|comprehensive air cargo experience|air cargo capacity|lufthansa group
a97d6b,gmr hyderabad airport cargo limited|gmr hyderabad airport cargo|hyderabad cargo charter circle|hyderabad international airport|hyderabad airport
3fa26f,gdp certification|ground handler dnata|more pharma logistics news|more ground handler news|good distribution practice
e37dd2,dhl global forwarding|dhl air connect|dhl air economy|dhl global|dhl ocean connect
e36973,lufthansa cargo e services|lufthansa cargo program manager|lufthansa cargo|e cargo|cargo process
ecdd7d,singapore airlines|tempchain service centre|singapore|tempchain service network|va-q-tec
c294f0,dhl supply|recent dhl report|technology deployment|dhl|new technology
e244dc,finnair cargo|cargo eye|cargo ground traffic|air cargo industry|cargo control center
17159c,pharma supply chain|pharmaceutical supply chain|pharma industry|dynamic services|pharma
475262,swissport cargo services|frankfurt airport hub|long-standing customer swissport|global swissport network|frankfurt airport
f34ac0,b&h worldwide group|new asian role|b&h worldwide|chris allen|new role
f3dd3b,gavi form vaccine delivery alliance|deutsche post dhl group|robust vaccine supply chains|vaccine supply chains|vaccine deliveries
eaee37,pharma container firm csafe|qatar airways cargo|pharma container|qatar airways|newest rap container
5d2b59,air cargo open data|liege airport|air cargo suite|air cargo sector|air cargo industry
ce3b7d,ups store printer|ups customers|60 ups stores|ups global distribution|ups location
4bd407,b&h worldwide vp|b&h worldwide|aerovision international|aerovision|service customers
84aa2d,upgraded çelebi delhi cargo terminal|çelebi delhi cargo terminal management|delhi cargo terminal|galaxy air cargo management software|cargo terminal
2525d2,kuehne|belcorp corporate sourcing director|nagel|belcorp confirms|supply chain deal
d4144e,peli biothermal team|peli biothermal|smi cold chain distribution conference|smi cold chain distribution|temperature-controlled packaging firm
bd49cc,lufthansa cargo cool center|lufthansa cargo|innovative sun protection solution|lufthansa|cargo
691955,successful iata operational safety audit|global audit programme|sfoc audit certification|sfoc audits|full audit efficiencies
dfc357,cargo terminal operation system|icargo terminal operation suite|global air cargo movement|airline cargo services|airline cargo industry
1e607a,brussels airlines cargo business development|brussels airlines cargo|brussels airlines|brussels airport pharma hub|ceiv pharma certification
8e9260,cargo handler dnata|ceiv pharma certification|additional ceiv pharma|dwc cargo hub|prestigious ceiv certification
3f756f,dhl global|pharma centre|logistics centre|life science competence|business park schiphol southeast
acc74f,dfw airport|ceiv pharma certification|international airport transport association|dfw|airport supply chain
666ca9,pelican biothermal|south korea|temperature-controlled packaging company|pelican|korea
7083bd,new dubai facility|db schenker|new logistics facility|new al maktoum international airport|global transportation company
d7c6ef,air canada cargo|air canada|distribution contract|two-year contract|international road feeder services
457f5c,lot cargo|champ cargosystems vice president|cargospot quotes|cargo routes|cargo director
f9143e,new customer portal|new booking portal|customer centricity|customers everything|individual customer
c205cf,lufthansa cargo|senior vice president cargo europe|cargo ramp transport|swissport belgium|general cargo
dcfc11,air cargo efficiency|iata cargo-xml standards format|air cargo shipments|electronic cargo manifest information|iata-wco collaboration
df2b37,advanced air cargo expertise|hong kong-based neutral air partner|advanced air cargo experts|air cargo community tools|air cargo specialists
4db03e,jettainer|uld controllers|uld management|uld fleets|15th anniversary
af3372,shanghai pudong international airport|new cool chain infrastructure|new eco-friendly cool centre|new cool centre|pactl vice president
53dd4b,compliance specialist|regulatory compliance|worldwide trade services network|compliance|trade services capabilities
42bbe5,iata ceiv pharma standard|iata ceiv pharma|own ceiv pharma course|ceiv pharma certification|wfs
af2b1c,sonoco thermosafe leasing services director|united cargo president|united cargo|global lease agreement|pharmaport units
5177c5,brucloud slot booking app|slot booking app|new brucloud slot-booking service|ad hoc delivery slots|brucloud data-sharing platform
a02bbd,air cargo trade|air cargo india|next air cargo africa|air cargo africa|messe muenchen member
3946fa,supply chain collaboration call|air cargo industry|air cargo expansion|air cargo|greater digital collaboration
1320c0,american airlines cargo|new controlled room temperature|new crt room|london pharma room|new room
bcf333,chep aerospace solutions|chep aerospace|uld management partnership|air transat|chep
f28883,first electronic dangerous goods declaration|lufthansa cargo|dangerous goods declarations|paperless dangerous goods shipments|dangerous goods process
25b250,dhl global forwarding americas|dhl global forwarding|dhl global|c-tpat supply chain security specialists|other global security programs
e1b791,ground handler booking app|new slot booking app|slot booking app|specific ground handler facility|ground handler facilities
2c6e56,lufthansa cargo cool centre|lufthansa cargo|cool chain cargo|cool centre expansion|cool centre
b750f9,peli biothermal|new coolpall flex|pharma packaging expertise|coolpall flex|new shipper system
fc3e98,virgin atlantic cargo dominic|virgin atlantic cargo|end-to-end cargo management software suite|other virgin systems|new cargo management system
d72e8d,celebi delhi cargo terminal management|kale cargo management system|cargo management system|delhi cargo terminal|domestic cargo movement operations
f9a352,second annual elevate conference|demovation challenge page|demovation challenge|elevate|logistics industry
e58cbb,kn pharmachain network|kn pharmachain footprint|kn pharmachain|kn north america president|puerto rico
61d025,first major blockchain solution|blockchain solution|blockchain technology|native blockchain interfaces|many blockchain projects
676c4a,schiphol group president|schiphol group|amsterdam airport schiphol|schiphol real estate|airportcity schiphol
6a8d74,repair certificate process|first-class repair partners|repair partners|flexible repair network|repair workshops
3f4b1f,tnt life science center|life science center|pharma center|new center|expanded center
47c98c,new supply chain solutions entity|supply chain solutions entity|supply chain solutions business|supply chain solutions experts|supply chain solutions
c02bf4,latest air cargo service provider|air cargo check-in|swissport warehouses|vice president global operations cargo|swissport plans
d9887b,delta cargo|current gps-enabled cargo tracking products|new bluetooth tracking technology|fly delta app users|fly delta mobile app
81dd8c,singapore airport terminal services limited|sats president|nacil ground|sats|nacil
40aca4,hamburg airport customs office|hamburg airport cargo center|hamburg airport|hamburg forwarding agents association|fair@link portal
a4c7fa,zeal global services|zeal global|asean markets|local market knowledge|strong digital platform
28df5f,ocean freight provider panalpina france|ceiv pharma iata accreditation|ceiv pharma certification process|ceiv pharma iata|panalpina france
8814d6,hong kong international airport|whole cargo acceptance process|cargo acceptance process|hong kong|cargo acceptance operator
552ba3,international logistics company jas forwarding|jas forwarding service teams|jas forwarding|online booking platform cargo.one|cargo.one platform
699893,lufthansa cargo|advanced passive thermal containers|passive temperature-controlled container market|cargo airline|lufthansa
eaf5da,1gsa president david lee|important korean market|goodman gls chief executive h.e|korean member|1gsa
f7468f,dublin network station|new network station|peli biothermal|packaging company|dublin airport
3be97d,lot polish airlines|lot cargo director michał grochowski|lot cargo director|lot cargo development|lot cargo
a2bc85,airbridgecargo airlines|sonoco thermosafe|airlines|pharmaport 360 temperature-controlled container|abc pharma' product
daddfc,cargo community air cargo belgium|new cargo facility|state-of-the-art cargo facility|brussels airport company|brussels airport
3acba0,logistics technology company descartes|trade data content solutions|descartes|business intelligence offerings|cloud-based trade data
265f68,va-q-tec sign container rental agreement|container rental agreement|tap cargo|air cargo europe|va-q-tec business development director
bac8d3,dhl campus vienna airport|dhl global forwarding|dhl freight|deutsche post dhl group|dhl global
faa2da,panalpina perishables network|panalpina family|panalpina|nairobi cold storage|cold storage space
f41808,provider champ cargosystems|customs solution|champ cargosystems|traxon global customs|first customs authority
efa0d2,"15,000th bluetooth tracking tag|core transport ships|core transport|core chief executive officer|15,000th coreinsight bluetooth"
72d118,dokasch temperature solutions|china airlines|china airline´s whole network|dokasch temperature|dokasch opticooler
3097d5,peli biothermal director|peli biothermal team|peli biothermal|coolpall flex shipper system|latest innovative bulk shippers
a5efcf,cool chain association|supply chain logistics|supply chain|world food supply|food waste prevention consultant
d6cf60,cargo iq certification renewal|cargo iq certification|cargo iq members|cargo iq|airlines ana cargo
0632d2,cathay pacific cargo|cathay pacific|more air cargo technology news|uld track|cargo terminal
d7c622,mobile phone specialist transsion holdings|mobile phone firm transsion|dhl global forwarding china|dhl global|airfreight solutions provider
e5ac49,multi-modal cargo operations|multi modal cargo operators|jan de rijk logistics|multi-modal operators|complex cool chain cargo
8101d9,world cargo symposium conference programme|world cargo symposium|other air cargo professionals|air cargo industry|new business opportunities
98a4d1,cca pilot data|pilot data|food waste campaigner|less food waste|pilot scheme
26b147,2019 air cargo innovation awards|2019 cargo innovation awards|air new zealand cargo|air cargo supply chain|2019 world cargo symposium
417592,"new french air cargo terminal|new 18,000m2 cargo terminal|korean air cargo|basel-mulhouse airport|terminal"
d48c47,long-standing partner american airlines cargo|envirotainer rkn e1 unit|american airlines cargo|american chills|rap e2 containers
4e2756,dhl global forwarding|new dhl campus|dhl freight|vienna airport campus|vienna airport hub
b53e28,us customs brokerage customers|previous dhl platform|dhl global forwarding|dhl global|deutsche post dhl group
ebed36,iata ceiv network|delta cargo|trans-atlantic ceiv network|delta vice president|iata ceiv
d913d8,innovative lufthansa cargo|lufthansa cargo|paperless security process|german cargo airline|air cargo industry
ab5d0a,blockchain standards definition|platform-agnostic blockchain standards|blockchain standards|enterprise scale blockchain adoption|blockchain technology
1735cc,"15,663 sq ft perishable centre|tsa-certified cargo screening facility|los angeles international airport|apollo|cargo screening areas"
46ed3b,catapult qms|city-based information technology company|catapult solution|catapult|mercator
e6dcdd,dupont protection solutions|new recycling program|complimentary recycling program|cargo covers|tyvek cargo
035e8e,south african freight agents|click2ship express imports|express wholesaler ami|freight agents|click2ship express
6fd9e7,online cargo processing platform|cargo processing platform|turkish cargo|cargo processing|cargo statuses
c2ad22,sky fresh platform|sky fresh app|online pharma platform|abc|sky fresh
b22d7b,"new netherlands distribution centre|new distribution centre|new centre|ceva logistics|3,000 sq m floor storage"
4f9065,cargo service quality tool|online cargo service quality|cargo service quality|singapore airport terminal services|cargo service standards
abacfc,tyvek xtreme w50 uld cover|uld protective covers|dupont european business development manager|uld cover manufacturer|cold temperature performance span
a3b476,temperature-sensitive airfreight pharma hub|hyderabad pharma hub|lufthansa cargo|key pharma hub|hyderabad airport
d9b345,ceva logistics|ceiv pharma status|new ceiv status|ceiv certification|ceva
79751f,peli biothermal president david williams|reynolds role|lynaye reynolds|quality role|peli biothermal
e5cc7f,iss global forwarding|iss global|global freight forwarding|future global growth opportunities|supply chain logistics industry
aeeee3,supply chain services giant kuehne|pharma logistics service|dedicated road-haul pharma network|k+n|pharma capability
fd9f31,iata ceiv pharma certification|iata ceiv pharma|cargo handler dnata|dwc cargo hub|additional ceiv pharma
99c156,iata ceiv pharma certification|swissport international ltd|swissport international|iata ceiv certificate|swissport
b8a94e,electronic dangerous goods declaration|dangerous goods declarations|germany-based dangerous goods|dangerous goods safety advisor|first e dgd declaration
ff61e7,galaxy air cargo management system|new air cargo management system|web-based air cargo management system|ground handler aviance ghana|aviance ghana
a33d76,new ibm blockchain solution|new blockchain solution|major shippers|supply chain blockchain technology|new suppliers
f6393b,brussels airport|tiaca csq tool|first airport|international air cargo association|general airport infrastructure
db15ac,bluetooth tracking trials|unilode aviation solutions|cathay pacific|unilode|other bluetooth deployment
29841a,iata ceiv pharma certificate|iata ceiv pharmaceutical certification|cargologic|ceiv pharma|international air transport assocation
d97164,etihad crystal cargo|etihad cargo|descartes cargo|air cargo process standardisation|executive vice-president cargo
19ff0e,amerijet international airlines president|amerijet international airlines|first all-cargo airline|amerijet vice president|iata ceiv pharma certification
8f6fff,regional carrier widerøe|widerøe cargo manager thomas|scandinavian regional airline|largest regional airline|e-cargoware software
98b9ec,pharma hub san juan|dhl global forwarding|dhl temperature management solutions|dhl facility expansion|san juan
9a2658,company unisys corp|unisys works|unisys spokesperson|unisys|electronic payment integration
914599,core solutions|uld solutions|coreinsight tracking solutions|innoaviation|tracking solutions
3926a3,cool nordic cargo hub facility|cool nordic cargo hub|€80m cool nordic cargo hub|finnair cargo|own cargo terminals
93df09,asiana airlines cargo|asiana cargo|asiana airlines highlights|asiana airlines|cargo management system
616224,benoit dumont|dumont|dr ludwig bertsch|unilode ceo|unilode aviation solutions
91d207,qatar airways cargo|qatar airways|envirotainer accreditation programme|qep accreditation|air cargo news
5e1101,logistics firm agility|agility area north west|human-use wda authorisation|agility|wholesaler distribution authorisation
c07bf8,cathay pacific cargo director|champ cargosystems chief executive officer|cathay pacific|champ cargosystems|champ
6866ef,envirotainer network|flagship rap e2 solution|rap e2 containers|rap e2|envirotainer
2a94ca,galaxy airport cargo handling system|widerøe ground|air cargo operations|kale logistics solutions|widerøe
73cebb,schiphol pharma initiative|entire pharma supply chain|14-member pharma gateway amsterdam|pharmaceuticals air cargo supply chain|schiphol cargo community
18424a,air cargo organisation tiaca|emirates cargo|global air cargo industry|air cargo|cargo business
6b131f,bolloré logistics|real-time shipment monitoring|transport logistic exhibition|bolloré|freight forwarder
78662e,self-service cargo check-in kiosks|self-service check-in kiosks|air freight documentation|kiosk system|swissport
c52eba,ami click2ship imports|click2ship express imports|former manual express imports system|express import shipment|express imports
3f8b39,heathrow cargo centre|cargo centre|air cargo operations|air cargo|coo cargo western europe
163c16,lufthansa cargo cool center expansion|lufthansa cargo cool center|lufthansa cargo board member operations|lufthansa cargo|cool chain cargo
524560,air cargo billing process|first blockchain-based air cargo billing|blockchain-based air cargo billing|typical air cargo billing|air cargo billing
dfed16,emirates skycargo|emirates divisional senior vice president|uae federal customs authority|economic operator member|federal customs authority
64d9b7,csafe rap containers|csafe global|active temperature-controlled air cargo containers|rkn active temperature-controlled containers|csafe rkn
04de5e,cargo iq members|cargo iq team|cargo iq membership|value cargo iq|cargo iq
b98540,dangerous goods supply chain|entire dangerous goods process|digital cargo portal|dangerous goods shipment|dangerous goods declaration
21d37f,etihad cargo|cargo control center|24/7 control center|advanced cargo information monitoring|iata interest group cargo iq
228fd7,cargo handler hactl|cargo handler|aircraft cargo compartment operations|real-life aircraft cargo|vr training system
affda6,singapore airlines cargo|cargo iq audit|cargo iq quality standards|cargo iq standards|cargo iq
12d2ef,new customer dashboard portal|new heathrow office|new customer portal|crane worldwide logistics|crane worldwide
930639,cargo quality center|champ cargosystems global sales|champ customers|cargo quality|champ cargosystems
da39f9,cargo joint venture partners|lufthansa-united cargo joint venture|united cargo|lufthansa cargo|cargo jv
4349c1,uld manager jettainer|lufthansa cargo vice president|lufthansa deal|lufthansa cargo|jettainer
68fcfd,cca members|cool supply chain|cca treasurer|supply chain management|cool chain association
80f8ec,goldstar heathrow director charile fulk|trailer manufacturer cartwright|goldstar heathrow|uk airfreight logistics company|goldstar
efc7c7,other wfs cargo stations|brussels cargo station|wfs|ceiv certification|ceiv-pharma certification
88d831,entire air cargo supply chain|air cargo supply chain|air cargo professionals|new air cargo leaders|air cargo netherlands
88b298,cathay pacific cargo terminal|cathay pacific|management firm unilode aviation solutions|cathay|unilode ceo benoît dumont
c9d6f8,swissport cargo liège|director swissport cargo services belgium|swissport cargo brussels|second swissport cargo station|cargo handler swissport
4c6f85,frankfurt community website|air cargo community|entire air cargo process chain|frankfurt airport|frankfurt
23c732,atlanta-headquartered delta cargo|delta cargo|delta air lines|delta vice president|delta
cee052,mumbai international airport|sure mumbai airport|mumbai airport|sharjah international airport|pharma supply chain
71a016,dokasch sign uld repair agreement|iata wcs|uld business unit|jettainer|dokasch manager
bde5f8,aisats cargo' app|aisats air freight terminal|only air cargo operator|real-time cargo tracking|aisats cargo'
3e5116,12 lockheed martin hybrid airships|12 hybrid airships|hybrid airship|straightline eyes $480m deal|hybrid enterprises
fd2eaa,american innovation centre|deutsche post dhl group|americas innovation center|dhl e commerce|innovation centres
7c473a,csafe service centres|csafe rap containers|csafe global|csafe containers|csafe rap systems
4f7c53,second logistics tech accelerator program|logistics tech accelerator program|logistics tech accelerator team|tech accelerator startups|logistics tech accelerator
3e51f5,virgin atlantic cargo|suzy wardle|digital transformation projects|digital roles|digital transformation
47e272,lufthansa technik logistik services|lufthansa technik|digital warehouse project|digital warehouse|lufthansa
d6071e,swissport finnair cool helsinki|cool nordic cargo hub facility|swissport helsinki ground handling|finnair cargo terminal|cool nordic cargo hub
15f11d,gefco forwarding warehouses|gefco group|gefco|life sciences|uk warehouse
00e5c9,viracopos international airport|aeroportos brasil viracopos|aeroport os brasil viracopos|second iso 9001 recertification|airport services
b50a80,logistics firm bolloré logistics|bolloré logistics chief executive|bolloré logistics|new digital solution|bolloré
ce6e33,pharma logistics firm marken|ups acquisitions|ups chief marketing|healthcare logistics services portfolio|ups
3a7696,new dhl global forwarding platform|dhl global forwarding|new dhl-gf portal|global airfreight|global head
89f9b2,on-airport perishable cargo handling centre|air india sats airport services|perishable cargo|perishables centre|preferred air cargo hub
0712df,jettainer|uld management subsidiary|arnd trapp|lufthansa cargo|various management positions
3228d4,global perishables markets|booming perishables market|cargolux global products manager|cca secretary-general|cca chairman
a6907e,brand-new online booking tool|cargolux airlines|new online tool|booking process|new tool
5cb3f1,lufthansa-united cargo joint venture|lufthansa cargo chief executive officer|united cargo president|united cargo|lufthansa cargo
2f520f,first hong kong-based freight forwarder|hong kong freight forwarder|chevalier aoc freight express holdings|first ceiv certificate|iata ceiv pharma certification
5ea879,netherlands-based de rooy logistics|de rooy logistics|jan de rijk|de rooy|logistic services
85d42e,sanofi geel vice president|nagel warehouse|global life science company sanofi|geel warehouse|expanded kuehne
207490,fraport executive board chairman|fraport ag|cargo 2000 quality management system|executive board member operations|cargo 2000 quality system
95414f,senior air india official|air india|2003 air india|iata operational safety audit|iata safety audit
c8cae1,ami|crowley senior vice president|airfreight wholesaler air menzies international|crowley logistics|air freight service offerings
828e5a,total supply chain visibility|global supply chains|kerry logistics|supply chain|smart sensor monitors cargo
3f384d,first aviation-compliant bluetooth roaming network|unilode aviation solutions|largest interoperable bluetooth network|bluetooth roaming network|unilode
b2c3f3,international supply chain management software|supply chain digitization platforms|end-to-end supply chain|disjointed supply chain partners|last week swiss forwarder
9005fd,rap e2 solution|rap e2 stations|rap e2 network|shanghai station opening today|rap e2
3ffe6e,global e-commerce fulfillment platform|new dhl solution|e-commerce fulfillment centres|dhl e commerce|dhl parcel
043e88,fedex express ships pharma goods|fedex express asia pacific|fedex express|clinical trial logistics requirements|japanese clinical trial
50919b,pelican biothermal|asia operations|pelican biotherman|asia pharma marketplace|asia
