document_id,terms
71310b,time:matters airmates|board courier services|on-board courier services|time:matters chief executive officer|airmates platform
3d9003,new paris pharma centre|iata ceiv pharma certification|new €10m pharma centre|pharma centre|ground handler worldwide flight services
77dd5f,top five innovations|top 5 ground|scattered operations|innovations|physical infrastructure
01e271,peli biothermal president david williams|peli biothermal|nanocool customers|nanocool|temperature-controlled packaging provider
ead796,iata ceiv fresh certification|ceiv fresh|alha fresh centres|ceiv pharma certification|iata ceivs
e3808a,cargo handler worldwide flight services|services wfs|heathrow cargo centre|wfs|fraport cargo services
6d24f3,"bolloré aerospace hubs|dedicated aerospace warehouse|aerospace warehouse|bolloré logistics|7,000 sq m aerospace facility"
bcf7c7,ibs test factory|partner ibs software|ibs software|lufthansa cargo ag|lufthansa cargo
088a10,brussels airport open pharma corridor|hong kong international airport|airport authority hong kong|a2a pharma corridor|pharma corridor project
3d0966,vice president etihad cargo|etihad cargo|dokasch temperature solutions|temperature-sensitive air cargo shipments|etihad cargo´s whole network
dce00d,tel-aviv-based cal group|cal group|first logistics group|cal|independent validators pharmaceutical logistics
0a7138,uld logistics management company|jettainer operators|five year cargo services contract|jettainer|jet airways
e99a8e,qatar airways cargo portfolio|qatar airways cargo|qatar airways|new rap container|csafe rap
9630f2,digital claims|abc|claims requests|digital platform|cargohub partnership
2e1a51,ed meyer|sales manager|peli biothermal|canada sales|global sales
b4b013,schiphol cargo|amsterdam airport schiphol|schiphol airport|schiphol group|new aviation marketing
c53ff3,ibs software senior vice president|dnata signs|icargo terminal operation suite|ibs icargo|dnata
0bc50e,luxembourg open innovation club|supplier champ cargosystems|champ cargosystems|open innovation|confident champ
2dd2c5,cathay pacific services limited|cathay pacific today|cathay pacific|hong kong air cargo terminals|airport authority hong kong
24d28b,12 lockheed martin hybrid airships|hybrid air freighters|lmh-1 hybrid airship|hybrid airship|hybrid enterprises
f1923f,dhl supply chain|latest smart glasses|dhl supply|smart glasses|other dhl business units
924adb,middle east road feeder services|air-cargo road feeder services operator|european road feeder services|provider wallenborn transports|wallenborn transports
afb6dc,unisys cargo solutions|unisys cargo user group|new cargo management solution|integrated cargo logistics solution|active cargo user group community
e12ca6,southside etihad cargo facilities|abu dhabi international airport|abu dhabi airports|air cargo terminal facilities|abu dhabi hub
3f7fd5,"swissport cargo usa|new chicago o 'hare warehouse|chief executive swissport usa|swissport cargo|new 138,000sq ft facility"
8422e1,second 24/7 control tower|new control tower|b&h worldwide group ceo|b&h worldwide|control tower
1d119a,emirates skycargo svp|emirates skycargo|nabil sultan|tiaca board|international air cargo association
59f833,ceva logistics|dublin facility|ceva|dublin addition|new pharma shipping
88c6c4,lightweight air cargo nets|air cargo nets|virgin atlantic|first lightweight cargo containers|traditional cargo net
9c765a,iag cargo|sixth gdp workshop|cargo service centre|second indian academy workshop|exelsius consultancy
54bd16,new instant freight rate|rate management service providers|own rate management services|available carrier rates|comprehensive rate editor interface
c874d9,ground handler lug|more ground handler news|ground handler|new management structure|expanded lug network
e6bdc7,japanese air cargo community|largest global cargo community system|cargo community system japan|international air cargo community|japanese cargo community
4d3b56,delta cargo vice president|gps-enabled cargo tracking products|delta cargo|bluetooth tracking technology|first us belly cargo provider
d5155c,changi airport e commerce airhub|sats e commerce|e commerce mail volumes|e commerce logistics hub|$21 million e commerce
0e4b87,dhl global forwarding greater china|dhl shanghai|dhl global forwarding|dhl temperature management solutions|dhl air thermonet station
5b90d4,delta cargo account number|delta cargo|cargo needs|latest cargo news|delta
b82230,lufthansa cargo|ibs test factory|air cargo domain knowledge|ibs software|test factory
67c15d,air connection acquisition|panalpina ceo stefan karlen|panalpina airflo|kenya-based air connection|kenya perishables position
749785,jomo kenyatta international airport|jomo kenyatta airport|expanded cold-storage space|panalpina|cold-storage space
9d80b7,new dhl logistics center|dhl supply|new pharmaceutical grade facility|dhl air thermonet airfreight station|new pharma facility
d22b4f,srilankan cargo users|srilankan cargo|srilankan skychain|srilankan airlines|srilankan step
94191c,russian freighter operator airbridgecargo airlines|airbridgecargo access|airbridgecargo|special ulds|special cargoes
baffdb,yusen antwerp logistics campus|yusen logistics benelux|yusen logistics|antwerp logistics campus|yusen campus
3be6c9,etihad cargo|first non-etihad cargo platform|air cargo industry|air cargo business|air cargo
d9c3b1,lufthansa cargo vice president|lufthansa cargo|air cargo supply|logistics tech accelerator programme|lufthansa
abd875,swiss worldcargo|e-awb effort|e-awb 360 campaign|single process|e-awb
5e9bfb,hamburg airport customs office|hamburg airport|hamburg freight forwarders association|dakosy fair@link system|fair@link air cargo community
12eafd,virgin atlantic cargo|virgin atlantic|cargo point operation|virgin|delta cargo
949408,gdp certification program centers|gdp certification|cargolux airlines|gdp surveillance audit|cargolux
c16ddf,liege airport|liege region|liege|next wecargo event|wecargo event
e08cde,hamburg airport cargo center|hamburg airport customs office|hamburg airport|fair@link air cargo platform|hamburg forwarding agents association
63180f,iata ceiv pharma certification|euroairport basel mulhouse|euroairport|temperature-sensitive pharma products|certification
4bbdc8,new jetthub centre|new jetthub|new logistics centre|lufthansa cargo uld provisioning area|uld storage
839f2c,multi-modal pharma shipment trial|abc pharma active solution|abc pharma product|airbridgecargo airlines|multi-modal shipment trial
0fd679,amsterdam airport schiphol|iata world cargo symposium|iata wcs|amsterdam schiphol|pharma gateway amsterdam
dab881,cass-usa—the us air cargo industry|import payment solutions|us air cargo industry|real-time payment platform—paycargo-cns system|online payment system
2ef89a,single warehouse management system|panalpina|jda wms|new wms|single wms
29b80e,american airlines cargo|cool management|global uld management|uld management|jettainer
456189,carousel logistics group|carousel logistics ltd|carousel logistics|fj miller|carousel
6349b3,martina rupp|rupp|new corporate head|corporate communications strategy|corporate communications
873964,full delta cargo product portfolio|delta cargo|new features|pharma containers|pharma shipments
5ced90,cargo iq members|cargo iq rebranding|cargo iq executive director|cargo iq|air cargo industry
e0f3ad,faa approval|dokasch opticooler|dokasch temperature solutions|dokasch americas|faa
db4c9a,first u.s. all-cargo ceiv-pharma-certified carrier|first u.s.-based all-cargo airline|amerijet international|amerijet|other air cargo industry stakeholders
1ffe65,air france klm martinair|air france|vice president cargo europe|customer service|sme customers
83b724,zurich-based carrier swiss worldcargo|swiss worldcargo|swiss international airlines|ceiv-pharma certification|air cargo division
ff7eaa,dnata uk|uk mhra certification|uk mhra|uk chief executive gary morgan|ground handler dnata
69b8e2,gssa firm scanpartners|cargo management platform|cargo management services|several gssas|cargo operations
7fa770,ceiv pharma certification|iata ceiv pharma validation|iata ceiv pharma standard|iata ceiv pharma|hong kong airport authority
d16c3f,pharma shipper members|standard pharma transport practices|aero chairman nathan de valck|aero initiative|hong kong international airport
b6ec9b,gls hong kong ceo|gls hong kong|systems provider champ cargosystems|hong kong|champ cargosystems
0eac36,turkish cargo|authorized economic operator certificate|first air cargo carrier|economic operator status|air cargo news
c57f4c,nippon cargo airlines|booking platform cargo.one|platform cargo.one|airline legacy systems|past airline integrations
6d5d47,sea-air boost|changi airport ground handler sats|sea-air connectivity|enterprise singapore|singapore
0bf66f,new melbourne airfreight facility|new melbourne airport freight precinct|airfreight wholesaler air menzies international|ami regional vice president|new facility
777cbd,sia cargo president|sia cargo|ceiv pharma certificate|singapore airlines cargo|six air cargo operators
773a23,new koolit advanced pcm gel|koolit advanced pcm gel|cold chain technologies|break-resistant gel pack|gel pack benefits
347630,airbridgecargo airlines|csafe rap solution|new csafe rap|csafe rap|csafe global
0e0322,brussels airlines uld management|brussels airlines|jettainer head|jettainer|unit load devices
5b03ba,alibaba group|open first overseas|alibaba|electronic world trade platform|new digital free trade zone
4d894d,jettainer|online platform|simple uld exchange|unit load device|online tool
b4ac81,air france klm cargo|jan de rijk logistics senior|air france klm stations|jan de rijk logistics|air france klm
79b95c,pharma shippers|penta freight|pharma|aero agreement|aero group
46ff30,air cargo community frankfurt|air cargo|medium-sized air freight transport companies|slv|community
c40e17,dhl global forwarding building|dhl global forwarding|dhl global|iata ceiv pharma standard|ceiv certification
0c74e3,15 rap e2 stations|rap e2 ulds|rap e2 container|rap e2|liege station
1ce032,way air cargo organisations|air cargo companies|air cargo carriers|digital gap|digital business
185536,va-q-tec global head|new latin american head office|va-q-tec founder|va-q-tec|latin american facility
406d64,pharma air cargo supply chain|quality pharma initiative pga|pharma gateway amsterdam|ceiv pharma|14-member quality pharma initiative
48ca2c,lufthansa cargo board member|alexander kohnen|kohnen|executive board|time:matters group
0b200c,kerry logistics|logistics service provider|logistics specialist|kerry|logistics
8c269c,first cargo terminal operator|cargo handler hactl|cargo terminal operations|smart facility operational capacity|cargo handler
933575,latest high-tech cargo management systems|cargo management systems|paperless cargo processing|video|future
b86885,etihad cargo|available cargo capacity|etihad aviation group|cargo airlines|cargo connect
e5d0db,bluetooth tag pallet breakthrough|unilode aviation solutions|digital bluetooth tags|bluetooth 5 digital tag|safran pallets
4a5f27,cool fresh cut flowers|fresh cut flowers|flower power purchase|cut flowers|kenyan flower market
9696b0,etihad cargo|cargo technology platform|etihad sprints|cargo management|etihad airways
f54b3d,traxon global customs coverage|traxon global customs|luxembourg-headquartered champ cargosystems|japan customs|champ cargosystems
74a099,new climate-controlled storage facility|new facility|new iso|specialist logistics provider|facility
d6a9d1,united cargo vice president|united airlines|united|dhl global|dhl temperature management solutions
01724d,air france klm|new airside temperature-controlled transporters|new temp-controlled transporters|new kold kart transporters|own airside pharma transporter
720f25,squair-timber skids|jettainer|product squair-timber|exclusive distribution agreement|squair-timber
2cc8d6,iag cargo|hangar 51 global innovation programme|2019 hangar 51 innovation programme|cargo logistics finalist|iag
cd8455,hong kong international airport|airport authority hong kong|hong kong-brussels airports corridor|a2a pharma corridor|specialist pharma corridors
abb4dd,click2ship express imports|click2ship express exports|click2ship express|south africa|new imports version
e4acdf,leisure cargo customers|leisure cargo|live spot rates|dynamic spot rates|cargo.one platform
40cb5c,air cargo industry|air cargo management|korean air|cargo management solution|air transportation industry
3d25af,forwarder tasco|online freight booking platform|freight forwarder|airasia booking platform|tasco team
662c7f,csafe rap temperature-controlled container|lufthansa cargo|csafe rap unit|csafe rap|csafe global spokesperson
c3752b,global logistics service contract|sas strategic relationship manager|sas aircraft|logistics service contract|sas
bde407,posta plus|kuwait-based logistics solutions provider|posta|logistics companies|logistics concepts
0102c9,chief cargo officer turkish airlines|tiaca air cargo forum|organisation pharma|turkish cargo|pharma industry
bb908d,agility global integrated logistics|brazil pharma centre|middle east-owned agility|similar pharma centres|agility
1b9347,ups fsls|ups europe|ups|medical device manufacturers|medical device
327476,uld partner general manager|uld manager customers|uld fleet management service|uld manager application|uld partner
cefc7d,air cargo world|air cargo excellence|air cargo|southwest airlines|same-day cargo service
3d4ab7,hong kong-based cathay pacific|cathay pacific|iata ceiv pharma certification|ceiv pharma standards|pharma shipper members
29d3ee,24/7/365 control tower operation|new round-the-clock control tower|abc control tower|new control tower|airbridgecargo airlines
44f7a4,liege airport cargo handling services|slot booking system|slot booking app|slot booking application|slot booking
f3b4bd,new global distribution centre|supply chain specialist ceva logistics|global distribution centre|ceva multi-user site|global spare parts facility
cf224d,jettainer owner|deufol airport services|jettainer|frankfurt airport|new facility
ca2799,db schenker middle east|db schenker board|db schenker|new dubai airport hub|new state-of-the-art logistics center
c71bc7,dhl global forwarding|dhl forwarding|iata ceiv pharma|dhl global|global stations
f6d60e,important cargo iq milestones|cargo iq partner stations initiative|cargo iq processes|cargo iq data|cargo iq framework
bca437,turkish cargo|iata ceiv pharma certification|turkish airlines aviation academy|turkish airlines inc|international air transport association
6b0fdd,lufthansa cargo board member|lufthansa cargo|fraport speed gate|cargo customers|cargo acceptance service
b228ce,state-of-the-art copenhagen pharma facility|new state-of-the-art pharma facility|wfs|2-8°c pharma products|pharma products
8f6edf,first ceiv fresh|ceiv fresh certification programme|iata fresh certification|iata perishable cargo regulations|ceiv fresh certification
615f48,lufthansa cargo vice president|lufthansa cargo|entire air cargo supply chain|lufthansa|corporate innovation professionals
f078e0,russia-based freighter operator airbridgecargo airlines|cargoclaims online platform|cargoclaims platform|airbridgecargo airlines|global customer service director
b2f374,ground handler gta dnata|gta dnata|first ground handler|gta aviation|pharma certification
b11905,entire uld fleet|unilode chief executive|uld fleet|integrated digital solution|uld management operations
887238,ijs global gefco uk|ijs global gefco nl|ijs global gefco|wholesaler dealer distribution|wholesale dealer authorisation
33100d,incheon pharma container repair centre|pharma uld-firm csafe global|container service centre facility|csafe global|other csafe hubs
d36a81,dokasch temperature|500th opticooler container|dokasch|strict temperature range|opticoolers
2282ed,logistics firm db schenker|db schenker|global contract logistics|e-commerce partnership|global logistics
05d3cd,aerospace logistics provider b&h worldwide|b&h worldwide|business development manager|singapore country manager bhupesh malik|key customer solutions manager
5a4027,dhl staff don smart glasses|digital vision|dhl supply|smart glasses|dhl
78a041,logistics manufacturing services|digital manufacturing capabilities|own 3 d printing research|shapeways chief executive peter weijmarshausen|shapeways community members
178d16,dhl global forwarding|dhl global|temperature-controlled facilities|brussels airport|facility
96a55e,dutch perishables specialist interfresh|dutch company interfresh airfreight handling|panalpina chief executive officer|dutch cargo connection|panalpina
e0d4f4,global technology-enabled solutions provider|mercator ceo|mercator team|mercator|commercial solutions
23f583,lufthansa cargo joint venture|long-awaited air cargo joint venture|united cargo president jan krems|cargo customers worldwide value speed|lufthansa cargo
d1066a,ceiv pharma certificate|new ceiv status|ceiv process|international air transport association|ceva logistics
65d8ab,new pharma group|air cargo forum|changi airport group|new pharma organisation|brussels airport head
f44e44,envirotainer container shipments|envirotainer provider training|pharma operation|temperature-sensitive pharma products|iata ceiv pharma certification
b2bf27,neutral air partner|neutral value-added services|neutral gssa|air cargo management companies|innovative global air cargo solutions
4289ff,iata|ipc team|international post corporation|international e-commerce|e-commerce shipments
d22fc6,csafe director customer support|american airlines|csafe global rkns|csafe ulds|aa cargo manager
3a34a4,russian all-cargo carrier airbridgecargo airlines|uld management agreement|uld tracking solutions|abc sticks|uld tracking system
91350c,american airlines cargo ulds|american airlines cargo containers|jettainer monitors|jettainer|uld management company
b8a08e,qatar airways cargo|qatar airways|global pharma cool chain|pharma containers|chief officer cargo
94b567,logistics firm arvato scm solutions|arvato scm solutions|new bonded warehouse|arvato|competitive supply chain solutions
40f960,b&h worldwide facility|b&h worldwide services|asia pacific expansion|ongoing asia pacific|b&h
d7f64b,lödige industries capability|lödige industries|air cargo industry|brand new uld|lödige
76592f,global air cargo industry|air cargo industry|ibs air cargo forum|global air cargo airlines|air cargo carriers
af0770,descartes velocity mail system|cargo carrier national airlines|air mail shipment tracking process|national airlines|cloud-based descartes vmail solution
5f719c,jan de rijk road feeders|jan de rijk logistics|jan de rijk|road feeder service contract|senior sales executive air cargo
e01ae8,csafe rap active container|csafe rap containers|csafe rap|virgin atlantic|csafe rkn container
32c005,goodman gls gssa business|goodman gls chief executive|goodman gls|1gsa network|independent gsa network
9fb11e,ceiv pharma partner airport|iata ceiv pharma certification|pharma shipper members|strategic pharma members|iata ceiv pharma
46a04c,ups contract logistics uk|new contract logistics facility|new ups site|new contract logistics centre|ups hub
85cc63,plug-and-play blockchain solution otb|first cross-border blockchain platform|other blockchain platforms|permissioned blockchain service|permissioned blockchain network
11caf2,other rap e2 stations|fifth rap e2 station|rap e2 network|rap e2 station|9 rap e2 stations
bf84e6,new pharma cargo facility|new pharma centre|new €10m pharma centre|new pharma facility|copenhagen airport
002b31,new innovation centres|innovative supply chain solutions|asia pacific innovation centre|innovation centres|k+n chief information officer
56f931,ami agent customer darielle moynes|ami uk|express wholesaler ami|ami|spot rate quote requests
afd9ee,american airlines entire uld fleet|american airlines cargo|american airlines|jettainer digitises|jettainer gmbh.
0d97f1,air cargo community frankfurt|fcs frankfurt cargo services|38-member air cargo community|air cargo community|lug air cargo handling
765707,gdp surveillance audit|gdp audit|gdp certification|cargolux|best distribution practice
3f7457,new airport member|miami international airport|pharma transport practices|changi international airport|hong kong international airport
f303d6,inaugural air cargo summit|air cargo summit|world air cargo awards|air cargo professionals|air cargo supply chain
aa6143,chep aerospace|chep client|chep president|chep|entire cargolux group
2209d9,air cargo community frankfurt|air cargo community|air cargo transport chain|air cargo hub|frankfurt executive director
9a97a4,cyber freight amsterdam|family-owned cyber freight|cyber freight|other pharma gateway amsterdam members|pharma gateway amsterdam
f83c92,csafe rap containers|csafe containers|csafe global|other csafe hubs|csafe rkn
7e0e0a,dhl global forwarding ceo|dhl global|iata ceiv pharma standards|dhl temperature management solutions|iata ceiv certification
d54c14,wise tech global|wisetech global group|wisetech global founder|logistics solutions provider|cross-border logistics solutions
7b42e9,riogaleão cargo team|riogaleão cargo|iata ceiv pharma certification program|temperature controlled cargo operations|riogaleão airport staff
56a535,dhl medical express service|dhl express brazil|dhl wmx service points|dhl wmx clinical trial platform|dhl express americas
b15a13,newly-formed wca e commerce network|cross-border e commerce logistics|cross-border e commerce shipments|wca member companies|cross-border e commerce
18637b,fcs frankfurt cargo services|frankfurt executive director|largest iata ceiv|frankfurt|air cargo community
061e57,iata ceiv pharma certification|iata ceiv pharma|ceiv pharma course|wfs amsterdam|wfs
ea6613,sats e commerce|new e commerce|sats ltd|sats|e commerce logistics hub
ad338e,strong pharma traffic|pharma investments|cv pharma product|pharma traffic|sure pharma growth
3167da,new acutemp plus series|csafe global|acutemp plus series|new era|csafe
dff64f,new amsterdam service centre|csafe rap active temperature-controlled containers|new service centre|csafe global|csafe rkn
6839e9,air cargo industry|real time data|digital data-based cargo supply chain|cargo industry director|entire cargo industry
097ea7,virgin atlantic cargo|virgin atlantic|suzy wardle|large scale digital transformation projects|digital roles
6d45e2,lufthansa cargo partners|lufthansa cargo|lufthansa group|lufthansa|air cargo carrier
051dcf,etihad cargo senior vice president|etihad cargo|cargo customers|air cargo sales|etihad airways
0de885,als logistic solutions|new goldhofer sales|goldhofer open joint location|goldhofer customer service|internal airport logistics
76c365,cargo iq data management platform|cargo iq working group|cargo iq executive director|cargo iq membership|cargo iq
a40ab6,"db schenker|schenker ag|logistics terminal|european land transport business unit|new 4,100 m2 freight-handling hall"
79ecf2,cargo handler dnata|ceiv pharma certification|perishable pharma cargo|ceiv certification|ceiv pharma
8d31eb,new ups healthcare facility|ups americas region president|healthcare facility|global healthcare industry|ups
532d7a,preferred logistics service supplier|preferred supplier status|service company bosch|special speed logistics expert time:matters|preferred supplier
9fbcce,crane worldwide logistics|crane|brussels airport|fons de haan|additional logistics partner
8eb213,new singapore logistics|new logistics centre|panalpina|other logistics services|singapore economic development board
37fe2c,brussels airlines cargo|brussels airlines|four airside pharma transport vehicles|airside pharma transporter|brussels airport
e68ca1,jettainer think-a-thon|jettainer|three-day think-a-thon|uld manager|transport logistic china
1f1eb7,other mobile dhl global|cargo mobile tracking app|dhl application|lifetrack mobile application|dhl global
470a22,air india cargo inks|air cargo|air india|next-gen cargo platform|next-generation cargo platform
106e31,dubai-based drone-delivery partnership|dubai-based technology company|autonomous drone delivery project|drone-delivery startup skycart|space autonomous drones
b444a8,celebi aviation holding|celebi aviation|virtual reality|training module|celebi
f677e0,swissport cargo services|swissport international cco nils knudsen|basel swissport|ceiv certificate|iata hands
930137,ljubljana airport ilogistics center|new ilogistics center|logistics center|ilogistics center|cargo-partner
dbe960,wise tech global|wisetech global founder|customs management solutions provider|wisetech global|systema acquisition
858260,personalised medicine logistics|personalised medicine puzzle|air cargo|american airlines cargo|personalised medicines
37a5cf,vienna-headquartered freight forwarder cargo-partner|cargo-partner ilogistics center|cargo-partner|advantage austria ljubljana|ljubljana airport
68407b,rutges cargo europe en j.m.|ams cargo center ii|ams cargo center|rutges cargo europe|sister company j.m. logistics
89222a,hong kong air cargo terminals|vr training system|hong kong|vr training concept|training systems
636f42,iata cargo iq certifications|cargo iq certification|cargo iq member|cargo iq master|cargo iq metrics
56f5e9,airside pharma transporter last year|airside pharma transporter|brussels airlines cargo vice president|brussels airlines cargo|brussels airport
6689c9,dhl supply chain chief|dhl supply chain|supply chain medicine|supply chain arm|supply chain
515919,cargo iq membership|global air cargo membership group|cargo iq community|japanese carrier ana cargo|cargo iq
d9dd45,new pharma cargo facility|cargo handler worldwide flight services|new pharma centre|paris cdg airport|paris cdg
db71b4,delta cargo|more air cargo technology news|full delta product portfolio|air cargo news|cargo specific flight schedules
686dec,k+n planning logistics innovation centers|international supply chain management software|k+n international|innovation centers|k+n
