document_id,terms
22ac39,voice-enabled air cargo system|amazon alexa|traxon air cargo shipment|champ cargosystems|open cargo trace
a50490,cologne bonn cargo center|cologne bonn airport|general air cargo activities|general air cargo|air cargo handling
31221b,nallian arms freight forwarders|freight management app|freight forwarders|delivery app|slot booking app
f43a69,current pelican biothermal customers|saas asset management software|crēdo proenvision software|pelican biothermal|new software versions
51505d,technology test bed logistics centre|panalpina chief executive stefan karlen|switzerland-headquartered panalpina|panalpina plans|panalpina
486160,swiss worldcargo open gdp facility|first gdp compliant airline facility|first gdp compliant pharma facility|swiss worldcargo|gdp certification
a0b8c6,panalpina|bogotá location|bogotá branch|gdp cert|bogotá region
e2259a,emirates skycargo cool dolly|emirates pharma air transportation solution|emirates skycargo team|emirates skycargo|temperature sensitive pharma cargo
37d394,wfs pharma centre|cargo handler wfs|open new pharma centre|new pharma centre|wfs pharma facilities
126109,etihad cargo|cool chain association|other air cargo industry stakeholders|etihad aviation group|perishables cool chain
8ee2f3,cargo.one air cargo booking platform|cargo.one digital booking platform|online booking platform cargo.one|ana cargo capacity|cargo.one platform
cbd6ee,swiss worldcargo|swiss international air lines|ceiv pharma certification|swiss authorities|ceiv certification
3bb6c9,amsterdam airport schiphol head|schiphol cargo pharma|busiest cargo airports|azura productions video|cargo
509490,etihad cargo vice president|dokasch temperature solutions|etihad cargo|temperature-sensitive air cargo shipments|dokasch temperature
624b64,ceiv pharma certification|iata ceiv pharma|mab kargo|ceiv pharma|global certification programme
e7722a,new uk facility|db schenker limited|schenker uk|db schenker logistics|db schenker
b50399,"new cargo centre contract|new berlin brandenburg airport|32,000 square metre centre|airfreight centre|airport city area north"
d92e49,iata ceiv pharma|new pharma|pharma trade lanes|aero members|pharma
7003c1,lufthansa supply chain contract|transatlantic supply chain contract|supply chains|dhl global|dhl
80bd8e,cloud-based software solutions|siemens|airport operations|airport digitalisation|major international airports
20cf01,handler wfs|segro-managed heathrow cargo centre|wfs finance director|heathrow lease|wfs
dc3cb2,delta cargo|more pharma logistics news|other pharma solutions|pharma 4 programme|pharma 4 network
0b86bb,swiss worldcargo|cargologic renew partnership|cargologic|long-standing partnership|proven partnership
381656,logistics network wca|newly-formed wca e-commerce network|wca member companies|alibaba.com logistics platform|wca chairman david yokeum
621617,unitrans signs va-q-tec deal|thermal materials specialist va-q-tec|unitrans arm|unitrans|va-q-tec insulation
2a2942,partners air cargo india|air cargo india|ibs software services private limited|air cargo industry|commerce retail-what air cargo
afaabc,gdp compliance training program|second gdp compliance training course|freight forwarder network wca|new compliance training program|freight forwarder group
5405db,real time tracking|lufthansa cargo|real time|tracking service|lufthansa
060410,italy-based airport handler bcube air|bcube air|malpensa airport certification|italian logistics group bcube|malpensa ceiv
aee2af,yusen logistics indonesia|yusen logistics|yusen indonesia|healthcare logistics services|first logistics business
6b8801,yusen logistics|yusen|pharma foothold|pharmaceutical supply-chain business|opening pharma
044bbe,ceiv pharma certificate|iata ceiv pharma|swissport|pharma gateway amsterdam|pharma product
6e6313,gls hong kong|ezycargo cargo community platform|gls deal|gls|digital cargo data exchange
9e3128,etihad cargo|etihad airport services|iata ceiv pharma|etihad aviation group|ceiv pharma certification
ea0732,successful digitisation|more airfreight digitisation news|air cargo community frankfurt|recent air cargo conference|frankfurt cargo city süd
a248c5,cargo facts emea|cargo facts|demovation startups|interactive cargo data|inaugural demovation challenge
49de2b,cargo steven polmans|greater industry collaboration|polmans|tiaca board|brussels airport head
162b4f,singapore changi airport|changi airport group|pharmaceuticals air cargo hub|changi airport|pharmaceuticals air cargo handling
268751,additional aa cargo widebody|aa cargo sales|aa cargo|american airlines cargo|puerto rican pharmaceuticals
898270,enhanced digital container|digital containers|jettainer|new containers|next generation
42b6d9,swiss pharma|nagel break ground|pharma hub switzerland|swiss export economy|new k+n logistics facility
4558bf,cargo iq use|cargo iq metrics|cargo iq framework|cargo iq guidelines|cargo iq
fbc1c6,iag cargo chief executive|iag cargo|iag group|hangar 51 startup partnership programme|iag
c6d775,panalpina|product quality|gdp quality assurance standard|business units|70 business units
1a8582,south africa|years groupair|groupair|hae|sub-saharan africa region
9462bc,new pharma white cover solution|new white cover xtreme|white cover xtreme|complimentary white cover protection|new dupont material
66158d,air cargo handler swissport international|swissport cargo liège|second swissport cargo station|swissport cargo brussels|swissport cargo services
091402,logistics software firm wisetech global|wise tech global founder|wise tech global|wisetech global group|powerful global development capabilities
680754,dhl e commerce singapore|parcel international direct us|parcel international direct australia|parcel international direct u.s|dhl network
8cb710,shanghai pudong airport|shanghai airport authority|shanghai entry-exit inspection|shanghai customs|third largest air cargo hub
5ed02f,alitalia vice president cargo|alitalia customers|alitalia|va-q-tec chief executive officer|va-q-tec sign
6f34e6,korean air cargo operations|korean air cargo|air cargo business|korean air|cargo revenue accounting
8b123e,new online booking service|maskargo customers|online booking service|international cargo services|cargo services
ec8096,gdp certification|ground handler dnata|pharmaceutical cargo|facilities management practices|gdp/pharma manager cargo
cd55c3,brucloud app|ground handler facilities|airport cargo communities|air cargo supply chain|air cargo belgium
1e4950,new smart phone app|smart phones|uld management provider|jettainer|worldwide management
a2534c,swiss worldcargo|swiss international air lines|swiss airfreight|cargologic|ground handler worldwide flight services
c532a8,us-based mallory|mallory|alexander international logistics|cargo tracking|multimodal tracking
ecd244,new host-to-host solution|aeromexico|champ customer|new solutions|host-to-host solution
af1b33,singapore ground handler sats|transport minister josephine teo|cargo pallet handling|singapore|minister
306881,national postal provider pos malaysia|pos malaysia international hub|pos malaysia|tigers team|tigers e shop
79b79f,iag cargo uld repair deal|airbase gse management teams|iag cargo operations|iag cargo customers|iag cargo
907c0c,cargolux airlines|cargolux signs|cargolux|friendly beam solution|lower aircraft engine emissions
de4789,cargo airline cargo management solution|nippon cargo airlines|nca|icargo product|business solutions
447304,pharma packaging firm peli biothermal|new us network station|condition peli biothermal|peli biothermal|new network station
fab561,turkish cargo|new pharma corridor|temperature sensitive cargo transportation|global air cargo authorities|air cargo trade
6396c9,air cargo|international air transport association|cargo language barrier|electronic cargo manifest information|world customs organization
4e8e38,former alibaba business guru guo|ceva logistics|global contract logistics|contract logistics|last mile logistics
382565,cargo handler dnata|dnata uk ceo gary morgan|uk mhra certification|uk mhra|uk medicines
d9634b,american airlines cargo|next generation cargo management system|web-based cargo management system|more cargo airline|american airlines
02296b,conventional airport-to-airport air cargo services|lufthansa cargo|reliable transport solution|new e-commerce solution|best transport solutions
f3ac1c,deutsche lufthansa ag|lufthansa|fraport|ground handler|labor director michael müller
06a48f,dokasch temperature solutions|global sales director|andreas behne|dokasch temperature|dokasch success story
39f9f9,new airfreight logistics hub|airfreight logistics excellence|new airfreight facility|nagel singapore|other kuehne
79e014,time slot management system|lug ramps|lug customer service centre|ground handler lug aircargo|frankfurt slot management
b0d8af,ami agent customer darielle moynes|ami uk|ami|1 millionth cargo spot-rate quote|spot rate team
c879b0,"new logistics hub|new 13,000m2 facility|new facility|logistics hub|agility"
4ae108,siemens postal|new manufacturing facility|new manufacturing site|new manufacturing plant|airport logistics market
e221ca,nippon cargo airlines|cargo capacity|first asian airline|cargo.one platform|core cargo system
ecce44,lockheed martin hybrid airships|12 lockheed martin hybrid airships|hybrid air freighters|hybrid airships|hybrid enterprises
a584db,lufthansa cargo|lufthansa|new apis|two new apis|cargo
577576,celebi delhi cargo terminal management|celebi delhi cargo terminal|celebi delhi|largest air cargo operator|cargo management system
a5f179,imperial logistics international|imperial logistics|vulnerable road users|truck safety systems|other road users
3bd83f,sats exports|one-stop e-acceptance initiative|e-acceptance procedure|export airfreight|sats
a8e4cb,peli bio thermal|peli biothermal customers|new thermal cover option|services peli biothermal|thermal protection covers
12449a,lan cargo signs chep|lan cargo|latin american largest airfreight carrier|proprietary repair management software actis|cargo equipment
3998f3,peli biothermal|french production site|bulk thermal shipper product|coolpall vertos product lines|production capability
3ce530,servisair cargo|agent gmd handlair|cargo network|new flagship operation|servisair
50a356,chinese automotive logistics joint venture|chinese automotive logistics group sincero|automotive logistics|contract logistics footprint|contract logistics
e8b3d5,new swissport pharma center nairobi|new swissport pharma center|swissport pharma centers|first global air cargo handler|swissport kenya limited
21689f,swissport brussels pharma center|new swissport pharma center|swissport pharma center|pharma center|swissport international
363e35,air france klm martinair cargo|air france klm cargo|air france klm martinair|air france|blue credit loyalty programme scheme
6580ad,chep scoops sia cargo deal|chep aerospace solutions president|chep aerospace solutions|sia cargo|singapore airlines cargo
4eab82,"164,000-square-foot logistics hub|singapore pharma business|logistics hub|singapore economic development board|logistics learning center"
a50241,wca regional office|already-established regional wca facilities|wca|new membership centres|new service centers
76acf0,pangea group network manager|300 independent freight forwarders|freight forwarders|pangea partners|automatic quoting system
27926b,wca time critical members|wca time critical network|wca time critical general manager|time critical|network members
1c3459,airasia x services|airasia x|renewed uld management agreement|uld management agreement|airasia wholly-owned subsidiary
1fd076,global standards|global head|dhl global|global level|airport cargo communities
0fd0a1,"swiss worldcargo|seven more years|cargologic processes 440,000 tonnes|reliable services|cargologic"
063b0f,american airlines cargo enterprise|american airlines cargo|new end-to-end cargo management system|air cargo news|aa cargo
bde369,bcube air cargo|iata ceiv certification|iata pharma certificate|second ceiv certification|milan malpensa airport
6ba981,crane worldwide logistics|additional logistics partner|crane|supply chain solutions company|supply chain solutions
ec1cb7,traditional heavy timber pallets|weighty wooden pallets|timber|cardboard alternative|cardboard fibres
516c32,french-owned bolloré logistics|bolloré logistics|latest canadian customs requirements|canadian advanced filing|air logistics supply chain
aeef09,hamburg airport cargo center|hamburg airport customs office|hamburg airport customs area|dakosy air cargo community system|initiator hamburg airport
d04d76,pilot project speeds cargo transport|schiphol cargo community members|schiphol cargo community|new pilot project|schiphol cargo
72da1b,lot cargo inks pact|lot cargo director|lot cargo|csafe rkn active temperature-controlled containers|lot polish airlines history
f8d0ab,uzbekistan airways|champ cargosystems|online portal|cargospot airline|traxon global customs
01161e,swiss worldcargo head|swiss worldcargo|new e-awb approach|e-awb efforts|e-awb 360 campaign
e83e31,driving pharma air cargo growth|air cargo pharma supply chain|air cargo supply chain|iata ceiv pharma certification|pharma supply chain stakeholders
2de9ba,globalia logistics network|globalia logistics|conqueror freight network|freight forwarding network|membership applications
0a1148,third perfect gdp audit|gdp audit|hong kong air cargo terminals|hactl manager|third year running
4b91cc,cargo iq sign mou|air cargo forum|cargo iq executive director|cargo iq standards|cargo iq
e6bee2,pharma air cargo supply chain|amsterdam airport schiphol cargo director|pharma gateway amsterdam|ceiv pharma program|amsterdam airport schiphol
395554,sia cargo|singapore airlines cargo|air cargo terminal airside|siginon divisional manager|siginon aviation
722280,cool nordic cargo terminal|finnair cargo terminal|more cargo terminal services|finnair cargo head|cargo terminal
ea96a0,crowley logistics deal|airfreight wholesaler air menzies international|crowley logistics|wholesale airfreight services|temperature-controlled wholesale freight services
e51829,two-year vse aviation contract|b&h worldwide group ceo|vse aviation president|vse aviation|b&h regional hub
c8bd6a,artificial intelligence tools|artificial intelligence|baggage management revolution|industry baggage systems|baggage management
ffcced,quality management system|royal cargo|qms manager|management|cargo transportation
a16956,pharma air cargo supply chain|schiphol cargo director|amsterdam airport schiphol|pharma supply chain|pharma efforts
a79375,bollore logistics uae|senior vice president uae cargo|international multimodal freight forwarders|freight forwarding industry|bollore logistics
6ea056,air france- klm|air cargo world|air france-klm|air freight|klm cargo
2e66ba,thrucool pharma product|sia senior vice president cargo|thrucool product|sia|iata ceiv pharma
5c5af3,alps dhl supply chain|dhl supply|post dhl group|nearby dhl freight|dhl parcel hubs
da3574,turkey-based ground handler celebi|celebi cargo|efficient electronic customs clearance|celebi|blujay solutions
02a8c4,cool chain association|cool chain standards|food waste prevention consultant|fifth global perishables event|food waste
934a3a,alibaba cloud|alibaba group|alibaba|bolloré logistics|bolloré group
123b35,malaysian freight forwarders|selangor freight forwarders|freight forwarders|malay forwarders|special services capacity development programme
d0db6e,db schenker logistics management|db schenker logistics|db schenker rail deutschland|db schenker rail|db schenker
9e3f08,long-standing partner american airlines cargo|larger rap e2 container|rap e2 containers|e2 containers|american airlines
fe0d71,csafe global|kalibox acquisition|csafe|kalibox|manufactures temperature-controlled packaging
2ed508,csafe rap active container system|csafe rap|turkish cargo|csafe global|csafe rkn
95d481,customs broker cargo|customs broker companies|cb customs broker|logistics firm time:matters|customs firms
beee04,iata air cargo innovation awards|air cargo innovation awards|air new zealand cargo|world cargo symposium|cargo composite
b0c738,lufthansa cargo cool center|lufthansa cargo board member|iata ceiv pharma certification|lufthansa cargo|ceiv certification
ab3a7c,new mobile delivery tracking service|forward air|air|us logistics firm|delivery route
9ad729,independent freight forwarding group wca|elite global logistics network|wca network leader|global logistics experience|entire wca group
f6e662,cargo iq standards|cargo iq members|cargo iq|cargo industry|airbridgecargo airlines
53328d,mab kargo halal logistics service|new halal logistics service|mab kargo|halal logistics service|halal logistics
cd2b55,cool chain association|cool supply chain|cool chain|supply chain management|supply chain
21d887,strategic push|nestle deal|fmcg sector|strategic importance|consumer goods logistics
338a08,cargolux director global logistics services|cargolux airlines|pharma gdp certification|cargolux|good distribution practice
f90f40,nippon cargo airlines|platform cargo.one|airline legacy systems|cargo system icargo|air cargo
213a70,global pharma supply chain|pharma supply chain|successful end-to-end cool chain delivery|cool chain association|cca gears
9c4373,etihad cargo web booking portal|etihad cargo|road feeder services|etihad|rfs services
f14063,life sciences cold chain|air freight cold chain logistics|dhl global|complete global frozen shipping services|big freeze
139941,italian e-commerce website e price|milan-based e-commerce website e price|e price|2017 e-commerce growth rate|new facility
5fe9b7,alibaba cloud|alibaba|new artificial intelligence|artificial intelligence|complex business analytics functions
dab1d4,virgin atlantic cargo|virgin atlantic|suzy wardle|digital roles|passenger-facing digital channels
4673a3,temperature-controlled shipping container specialist va-q-tec|va-q-tec signs|va-q-tec|worldwide logistics group|shanghai tempchain service center
ce3135,cargo service quality tool|new cargo service quality|singapore airport terminal services|cargo service standards|service quality benchmarks
dc8e63,ibs icargo|ibs software|pos aviation|airline cargo services|cargo management platform
3a221b,korean air cargo|korean air|unilode aviation solutions|entire uld fleet|regional uld management office
7ebfcc,valuable temperature-sensitive cargo|temperature-sensitive cargo|white cover advanced|cargo operations|emirates skycargo
2793f2,china airlines|csafe pharma containers|csafe global|global customer support|airline partner network
1a697b,ai-powered robotic air cargo system|robotic air cargo system|cloud-based cargo terminal management system|digitalize air cargo|singapore-based ground handler sats
ce1050,software developer core transport|service product solace cloud|solace|air transport industry|air carriers
413c03,wca china|wca chief executive dan march|e commerce network|wca|new member support office
3a369e,oag it cooperation|champ cargosystems|director oag cargo solutions|champ|critical real-time rate data
8690ad,brussels airport head|slot booking app|brussels airport|recurrent time slot|intern slot management system
63d208,conglomerate bolloré group|e-commerce firm alibaba group|bolloré group|partnership deal e-commerce giant alibaba|bolloré logistics
b9a716,emirates skycargo|belo horizonte airport cargo manager|emirates|bh airport|belo horizonte airport
002928,john west foods contract|john west foods|ceva logistics|ceva team|john west
5022ad,gdp renewal audit|cargolux director global logistics services|cargolux airlines|cargolux|renewal audit
1badea,korean air cargo|new cargo management system|korean air|next-generation cargo system|end-to-end cargo business functions
18bc7e,kerry logistics chairman|kerry logistics|offshore support centre|first it development|new it development
a18cd6,lufthansa cargo ag|cargo customers|cargo acceptance service|speed gate|lufthansa cargo
5055de,swiss worldcargo|gdp compliance certification|secure gdp compliance|swiss authority|gdp compliance
7bff48,dnata optimises operations|uae airport operations|dubai international airport|cutting-edge resource management system|dubai airports
b5e03f,former iata global cargo chief|iata world cargo symposium|iata global head|air cargo innovation award|air cargo week
639517,bollore logistics head|bollore logistics|canadian e manifest|e manifest advance commercial information|well-known solution traxon global customs
4e7ec1,pharmaceuticals air cargo conference|air cargo news life sciences|air cargo news|big names line|acn pharma conference
e967c0,ceiv pharma certification|ceiv pharma programme|new dallas facility|ceiv pharma|state-of-the-art cargo facility
a2da5f,"new 30,000 square metres facility|new build-to-suit facility|singapore country head|new facility|new 30,000 sqm warehouse"
58e8ae,pilot cargo terminals|air india sats cargo terminal|new online cargo service quality|celebi cargo terminal|delhi cargo service
be7345,cargo check-in|vice president global operations cargo|new air cargo facility|self-service check-in kiosks|cargo warehouses
21b947,csafe rap temperature-controlled containers|csafe rap|lufthansa cargo|csafe global|csafe
89a244,riogaleao cargo|tom jobim international airport|cargo terminal|riogaleao|economic operator status
cfef0b,cargo iq members|cargo iq|airbridgecargo airlines|highest industry quality standards|air cargo industry
f699da,croamis latam cargo|latin america latam cargo|various cargo management systems|latam cargo|croamis cargo management solution
04b66d,open european service centre|european service centre|peli biothermal|uk service centre|asia service centre
0924b3,cargo iq certification|cargo iq technical group|independent cargo iq|cargo iq|abc executive president denis
ee76be,ccs-uk advanced info module|new ccs-uk module|u.k.-based airfreight body ccs-uk|ccs-uk user group|ccs-uk advanced
761542,cca event next month|cca board member vijan chetty|fresh park venlo facilities|130 hectare fresh park venlo|cool food chain
65ffed,vienna airport head|vienna airport region|vienna airport|cargo-partner ceo|ilogistics center project team
dcd3eb,oman air cargo|air cargo sector|oman air|international air transport association|electronic air waybill
8dd12f,ups true cryo|ups europe director|true cryo service|ups temperature|ups proactive response
ed2922,jan de rijk logistics|jan de rijk|netherlands-based omega logistics|omega logistics|omega
b6fad1,united cargo president jan krems|united cargo|rental units|newest va-q-tainer unit|va-q-tainer units
3ff547,united cargo jan krems|united cargo|temperature-controlled skycell containers|skycell containers|temperature-controlled container manufacturer
df8a8e,lufthansa cargo cool center|new cool center|cool chain cargo|lufthansa cargo|cool center
2abed3,logitrans|ifm istanbul expo center|important logistics specialists|11th time|new istanbul airport
5057f9,intelligent container|lufthansa industry solutions|jettainer|digital containers|containers
6b6185,shipper bi big data tool|bourque logistics|new big data tool|texas-based logistics software|shipper bi
e360cc,branch manager yusen logistics schiphol|yusen logistics european pharmaceutical superhighway|managing director yusen logistics benelux|cro yusen logistics europe|yusen logistics europe
0ba67a,abu dhabi airports free zone|logistics firm gac abu dhabi|gac abu dhabi|cargo terminal free zone site|abu dhabi
cfe482,blujay global trade network|blujay global trade|blujay solutions|traditional supply chain solutions|global supply chain ecosystem
e08a0b,swiss international air lines|swiss worldcargo|first gdp-compliant facility|ground-handling giant worldwide flight services|wfs
dee0ba,cargoit ab chief|cargoit ab|traxon cargohub|traxon|iata cargo-xml version
2880c8,secure trade lanes|sstl air pilot project|end-to-end supply chain security instruments|china smart|customs-to-customs pilot project
0b3cbc,csafe global|csafe rap|alitalia|active temperature-controlled containers|new pharma containers
55ee96,dachser eyes logistics innovation|dachser road logistics|dachser enterprise lab|dachser chief executive|dachser
8ba8f7,pelican biothermal|global cold-chain shipping|cold-chain packaging providers|cold-chain shipping|cost-conscious global pharmaceutical manufacturing companies
5850b1,new resilience360 mobile app|resilience360 mobile app|post dhl|dhl customer solutions|supply chain risk management space
224d43,"heathrow pharma facility|josette wells gefco forwarding quality|new 15,000 sq ft facility|new uk facility|more pharma logistics news"
748932,digital platform freight bro|india-based freight forwarder platform|middle east freight industry|first freight forwarder|freight bro
7b8023,temperature-controlled logistics specialist|thermotraffic|temperature-controlled goods|temperature-controlled cargo|pharmaceutical logistics
c7e7df,u.s.-based csafe global|csafe rap|csafe rkn|csafe|cool-container service center
07996e,turkish cargo|new interface|new website|cargo tracking|corporate website
5280a6,el al|first online freight shipment|first online booking|online booking platform|el
1d0ab7,champ academy|wider champ customer base|firm champ cargosystems|champ solutions|champ
f6fb72,lifetrack mobile app|dhl temperature management solutions|dhl global|lifetrack app|dhl thermonet
566444,unique air-sea multimodal connectivity|sats|key multimodal transport hub|psa international|multimodal connectivity
98d2a6,envirotainer chief executive officer|envirotainer|chep aerospace|chep|repair stations
27b4c4,swiss international air lines|swiss worldcargo|new organisational structure|swiss head|swiss
8e8ffb,air cargo supply chain|cargo iq group discussions|cargo iq|ground handler dnata|cargo performance
9778a9,air france klm martinair cargo|csafe global strategic sales director|partner csafe global|csafe rap|csafe global
29719b,e-commerce fulfilment specialist e-services|kerry logistics|e-commerce fulfilment|kerry|second jv
