document_id,terms
cdd606,carrier american airlines cargo|24/7 service|cool management|transportation process|abu dhabi|excellence|entire fleet|airline|american airlines cargo reefer containers|temperature-sensitive air freight
55777d,director dhl global forwarding austria|specific temperature range|competence center|product|air shipment|medical device industries|vienna pharma centre|sensitive goods|zones|particular importance
40aca4,hamburg airport customs office|connectivity|physical processes|hamburg forwarding agents association|new platform|traffic management|hamburg airport cargo center|co2 savings|deliveries|same time
72d118,china airlines|dokasch temperature solutions|temperature-sensitive air cargo shipments|global network|main hub taiwan|reliable container|competitive market|cooperation|weather conditions|destinations
1735cc,tsa-certified cargo screening facility|los angeles international airport|perishable centre|ocean containers|apollo|specific products|total cold chain protection|positions|final destination|off-airport warehouse
b22d7b,"new netherlands distribution centre|features 28,000 bin locations|logistics company|industrial estate|ocean ports|floor storage|excellent transport links|expansion|yard|receipt"
68fcfd,supply chain management|data|food loss|air france klm martinair cargo|director verticals global head|perishable shipments|temperature curve|initiative|cca members|collaboration
0f5119,minnesota manufacturing awards|life sciences industry|thermal protection packaging solutions|indianapolis|pelican biothermal president david williams|demand program|united kingdom|innovation|distinguished business award|minnesota business magazine
0af32b,iata ceiv pharma certification|customers|global hub|consistent pharma product|pharma industry vertical team|transport service providers|fastest-growing all-cargo airlines|control processes|pharma shipments|quality program
346a0c,container partnership|ambient temperature|cathay pacific cargo|proprietary hybrid technology|transportation supply chain|high-value medications|data services|payload|telemetry system|lengthy truck lanes
92e797,iata ceiv pharma certification|ana|new product|first airline|quality management|cargo operation|numerous enhancements|fixed temp|pharmaceutical products|first japanese carrier
4d106d,ceiv pharma certification|cool-chain perishable cargo facility|airport spokesperson|global quality standards|shippers|high-value products|texan hub|aviation sector|ceiv pharma community|innovative services
67ba35,"air india sats airport services|economic growth|integrated on-airport perishable cargo|trial operations|11,000 square metre facility|imports|aisats chief executive officer|vegetables|temperature-sensitive products|infrastructure"
6c2a13,temperature-sensitive healthcare products|rap container|autonomous temperature management programming|vice president|time-critical shipments|innovative solutions|shippers|value|protection|csafe global
2bf30b,heathrow south cargo centre|eight degrees centigrade area|airfreight market|security certification|facility|a30 trunk road|expansion|heathrow airport|service provide|east
300c5c,low temperature technology specialist va-q-tec|passive containers|pharma shippers|logistics service providers|two pallet capacity|uninterrupted cold chains|cool container firm|medical products|temperatures|regulatory requirements
8b6f2e,clinical trials sector|fedex express|sensitive healthcare products|dedicated customer service team|medical device industries|reliability|healthcare business|europe three years|global marketplace|time-sensitive shipment
0822e0,world cargo symposium|shipments|service standards|logistics value chain|cargo operations control centre|way emirates skycargo|external audit company|delivery commitment|sgs|freight division
382565,gdp certification|variable temperature ranges|sophisticated 24-hour warehouse monitoring system|facilities management practices|pharmaceuticals|potential transport routes|operations documentation|quick response|enhancements|good distribution programme
722280,"finnair cargo terminal|3,000 square metre pharmaceuticals area|operational processes|international air transport association|cargo capacity|storage rooms|cargo terminal services|niche cargo goods|hub|eight degrees celsius"
f6e662,cargo industry|audit execution|membership|manager implementation|quality assurance|supply chain stakeholders|dedicated abc team|sgs|operations|compliance rating
53328d,mab kargo halal logistics service|global halal food market value|ms2400-halal certification|malaysia aviation group companies|secure air cargo handling|suppliers|government minister|labuan halal hub|launch event|additional facilities
a669f7,melbourne international airport|etihad cargo senior vice president|mutual pharma customers|abu dhabi international airport|such vital products|temp check locations|sydney kingsford smith international airport|airline|kennedy international airport|manchester airport
7a84c5,heathrow cargo centre|new pharma facility|future space requirements|well-located industrial units|copenhagen airport|airside facilities|real estate investment trust segro|build-up|central london business unit|2-8°c pharma products
44d783,precise temperature mode conditions|temperature-sensitive shipments|important agreement|airbridgecargo airlines|pharmaport 360 temperature-controlled containers|monitoring systems|much-needed air freight solution|delivery options|business development|deviations
eba27a,pharmaceutical shipments|first airlines|board member product|ceiv certification|frankfurt cool centre|pharma products|lufthansa cargo|german airline|past few months independent specialists|innovations
7847e1,carriers delta cargo|first-rate cold-chain pharma programme|new csafe rap container|partners airlines|euro pallets|extreme ambient temperatures|atlanta warehouse|large payload compartment|facilities|csafe global
b8062a,"ups acquisitions|healthcare logistics services portfolio|pharmaceuticals air cargo conference|49,000 clinical trial sites|global markets|long-term growth plans|life sciences industry|pharmaceutical companies|regulatory approval|efficiency"
37e270,director global services|bulk shipping container|integrated faa-approved telemetry system|cargolux airlines|pharmaceuticals|partnership agreement|ambient temperature|smooth transportation|asia-pacific regions|industry
4157e4,swiss international air lines|independent logistics sector|belly cargo world conference|freight forwarding network|strong global reputation|operational information|shippers|specialty groups|logistics market|airlines
529d6f,new rap temperature-controlled container|constant payload temperatures|european aviation safety agency|successful shipments|csafe global president|proven system designs|thermocor vip insulation|approval|battery life|csafe rkn active container
3672ad,kenyan cargo handler siginon aviation|jomo kenyatta international airport|high service standards|new agreement|airline customers|singapore airlines cargo|ground operators|kenya civil aviation authority|art air cargo terminal|business growth
e8f155,"second vienna airport warehouse|cargo documentation services|senior vice president central europe|7,000 square metres|aircraft|long-term lease agreement|shipments|second air cargo warehouse|vienna international airport|direct airside access"
185536,new latin american head office|operations facility|pharmaceutical industry|central distribution hub|local client base|logistics services|chief executive officer|south america|state-of-the art airport facilities|temperature
d6a9d1,united cargo vice president|puerto rico|pharmaceutical products|pharma partnership|hot gas injection system|strong global network|newark liberty international airport|486 pallets|sales americas|life sciences industry
ca2799,contract logistics development|new dubai airport hub|second logistics center|africa region|karl-heinz emberger chief executive|logistics service providers|patronage|temperature-controlled warehouse|three phases|logistics district
b228ce,"state-of-the-art copenhagen pharma facility|2-8°c pharma products|gdp|4,700 square metres freight centre|copenhagen airport|important pharmaceutical production sites|temperature control areas|strict requirements|cargo strategy|worldwide flight services"
e01ae8,csafe rap containers|virgin atlantic|thermocor vacuum installation panel technology|bookings|healthcare products|temperature range|cargo manager|european aviation safety agency|pharma transportation|csafe global vice president
9fb11e,ceiv pharma partner airport|whole air cargo industry|pharma shipper members|iata ceiv pharma certification|moscow sheremetyevo hub|airbridgecargo airlines|pharmaceutical logistics|hong kong international airport|alha group audit|international air transport association
7e0e0a,dhl global forwarding ceo|rigorous audit certification process|international air transport association center|iata ceiv pharma standards|pharmaceutical industry|dhl temperature management solutions|stations|key u.s. hubs|third parties|product integrity
18637b,fcs frankfurt cargo services|major pharmaceutical hubs|certification process|international air transport association|bollore logistics germany|hub|air cargo community|independent confirmation|airline|corporate boundaries
1f1eb7,cargo mobile tracking app|cold-chain shipments|apps|dhl application|other mobile dhl global|management platform|temperature changes|lifetrack app|round-the-clock cold-chain experts|shipment
2aee30,united cargo tempcontrol|temperature excursions|vaccines|quality service today|co2 footprint|temperature-sensitive containers|health care shippers demand|pharma industry|other factors|sky cell
2d7394,"25,000 square metre warehouse|time efficient logistics processes|brand new swissport pharma center|brussels airport company|benchmark|end-to-end facilities|long-term job security|four-storey office building|ambient pharma space|automated material handling system"
68a1dc,pharma shippers|air cargo supply chain|amsterdam university|data collection|pharma temperature alert system|operational integrity|rijk logistics|netherlands organisation|collaboration|iata world cargo symposium
a4df5e,"state-of-the-art air cargo centre|future growth area|new pharma hub|vienna airport|60,000 square metres|transport infrastructure|good market position|logistics centres|facility expansion|management board"
ff6cde,iea gdp passport certification|campbell mccleave company accountant|whole supply chain|medicinal sector|logistics service providers|levels|irish exporters association|good distribution practice|life sciences|new clients
779ac7,world customs organisation|aeo certificate|only air cargo carrier|rapid shipment advantage|certification|recent major move|labor thanks|international arena|turkey|methods
6db385,cathay pacific director cargo|uld fleet|pallet assets|five-year renewable agreement|lightweight containers|air canada|operational requirements|uld management deal|thorough review|galley cart services
d38cc0,"vienna pharma hub|own exclusive handling area|countries|facility|temperature-controlled shipments|logistics solutions|pharma centre|regional airfreight manager|1,600 sqm|service levels"
84f7d8,euroairport cargo terminal|temperature sensitive pharmaceuticals|first airport authority|switzerland|iata ceiv pharma certificate|world|fischer road cargo|high quality standards|efficient processing|presence
382423,general manager cargo service delivery|cathay pacific services limited|first airline|quality assurance|shipment journey|global standards|hong kong|perishable products|ceiv certificate|new certification
f38b99,csafe rap temperature-controlled container|united cargo|temperature-sensitive healthcare products|life science companies|important medical shipments|evo cold chain 2.0 system|euro pallets|lifeguard services|innovative csafe technology|reliable solution
3fe7e4,temperature sensitive shipment sectors|business cooperation|cool chain infrastructure|shanghai airport authority|customer values|pharmaceutical sector|personnel skills|memorandum|trustworthy partners|contribution
51fa1e,american airlines cargo|autonomous temperature management system|csafe rap temperature-controlled active containers|joint pharma customers|healthcare shippers|global reach|key option|air recirculation technology|vip insulation|product
8ede8e,flower shipment data|air waybill numbers|supply chain partner|pharma gateway amsterdam|smart cargo mainport program|unique gln code|format|box level|group project manager|shipments
bf1809,iata ceiv pharma certification|dachser india|pharmaceutical logistics recognition|industry standards|hyderabad branch|major supplier|international air transport association|healthcare|region|deviation management
b5730c,pharma shipper|new business operations|container tracking system|csafe vice president|range|landmark production total|kalibox passive pallet shipper|regulatory pressures|innovative time|japan
185025,air india cargo contract|new pharma facility|temperature-sensitive pharma shipments|gdp|worldwide flight services|separate temperature chambers|premium cargo products|electronic roller bed system|denmark|main warehouse
d4448b,"qatar airways cargo|healthcare products|pharma network|complete quality audit|active pharma containers|gdp guidelines|2,470sqm airside transit facility|global customers|first-rate air transportation|milestone"
04aa9e,agility life sciences customers|new hyderabad pharma facility|exports|global logistics|top investment destination|box packaging|rajiv gandhi international airport|indian life sciences companies|products|control tower
83f456,new temperature protection solutions|emirates skycentral cargo hubs|white cover advanced|tyvek high density polyethylene material|dubai international airport|variable weather conditions|temperature sensitive cargo|pharmaceuticals shipments|art cool chain facilities|lightweight thermal cargo covers
4e3c63,cargo infrastructure|pharmaceutical logistics services|basel warehouse|long-term lease agreement|temperature range|new facility|frankfurt airport|ipo|ceiv certification|aviation sector
36cff7,american airlines cargo manager|healthcare facility|iata ceiv pharma certification|international air transport association|pharmaceutical shipments|cold chain strategy|abilities|first u.s. carrier|independent validators|philadelphia international airport
619ffe,global pharmaceuticals sector|network station|pharma logistics news|new frankfurt facility|worldwide expansion|company|demand rental program|location|sao paulo|additional depot
aa8693,lufthansa cargo customers|passive refrigeration segment|va-q-tainer thermal containers|five days temperature stability|pharmaceutical market|home hub|availability|frankfurt|pallets|infrastructure
883b57,iata ceiv pharma certification programme|air cargo supply chain|new client structure|health care center|lug spokesperson|healthcare shipments|expansion project|competence team pharma|adaptation|company
7fade7,new perishable management application|digital platform|perishable capabilities today|inspection process|brussels airport|perishable management app|communication|document exchange|food chain|open data
761857,international air transport association|csafe rap containers|other carrier partners|swiss worldcargo|latam cargo|ceiv pharma certification|100 global destinations|handler worldwide flight services|inroads|lease agreement
e205fc,frankfurt airport|demand network|netherlands|key logistics hubs|new european drop points|zurich airport|milan airport|munich airport|dublin airport|rental drop-off
