document_id,terms
9b1eca,new boeing 777 freighter in service on routes between asia|air cargo gateways in north america|first boeing 777 freighter|asia-north america air cargo routes|freighter destinations in asia|boeing 777 freighter|north america in late november|with 35 weekly freighter flights|777 freighter|largest twin-engine air cargo carrier|airfreight services across 62 routes|new phase of freight expansion|north america by|eva air|md11 freighters
0af138,closer cooperation with iag cargo|with iag cargo|advantage of iag|iag cargo|summer as part of|freight arm of british airways|finnair cargo|for iag|other members of|enhanced interline cooperation programme|markets in south|customers better access|major northern european hub|iag|position as
d8da8b,kf aerospace as new freighter conversion centre|boeing shanghai aviation services in shanghai|commercial jet services in dothan|additional capacity for passenger-to-freighter conversions|commercial jet in miami|additional conversion capacity|13 conversion lines at|three conversion centres|major facilities in kelowna|kf aerospace as|conversion center|kf aerospace|boeing 737-400s from april|aei picks|aei
a387bd,delivery of brand new boeing 747-8|number of frequencies from shanghai|customers with more capacity as|development plans despite delays in|new 747-8 freighters|delivery of|end of 2009|boeing 747-8|additional boeing 747-400|five of|fifth 747-400 freighter|total freighter fleet|such as shanghai|abc|aircraft capacity
f23c5e,"for 20 per cent of china|more than 3,700 tonnes of cargo capacity|by 26.3 per cent on|gatwick with shanghai|gatwick airport chief executive officer|showpiece of china|shanghai pudong airport|by china eastern airlines|gatwick on tuesdays|shanghai in december|on extra significance in|launch of flights|gatwick airport|on 7 december 2018|by new long-haul routes"
4002d3,new online booking platform|available for use in more than 60 countries|new online quote|booking platform for air|toll global forwarding president thomas knudsen|core tools for forwarders|online booking|dhl global forwarding|loadstar that two more forwarders|prior online tool|for quotes|new service|addition of kontainers|kontainers in|global logistics provider
9ee3ea,nile river in uganda|84 tonnes load of heavy machinery|important project in uganda|gap for uganda|hub in dubai|field teams in japan|high profile charter for|uganda along with|freighter aircraft operator|emirates vice president|boeing 777 freighters|hub operations teams|emirates skycargo|steel parts for|load from tokyo
9c448a,presence in latin america as part of|presence in latin america|development of new airfreight links|air cargo community in|new developments such as logistics 4.0|rapid economic growth in recent years|airfreight industry in mexico|2020 event in miami|as part of|mexican association of freight forwarders|tiaca partners with amacarga|international air cargo association|new ways of|air cargo forums 2018|october in toronto
7fbc07,pharma businesses in sri lanka|importer of pharma|pharma network on 15 may|future earnings from pharma exports|in terms of time|top ten largest pharma companies|pharma route network|extensive pharma network|republic of ireland|qatar airways cargo|pharma network|pharma manufacturing project at|colombo in sri lanka|dublin in ireland|addition of colombo
bd1fb2,"136,685 sq ft industrial facility in|san francisco-headquartered freight forwarder flexport|south bay area of los angeles|charter flight from hong kong|more freight forwarder news|hong kong charters|new charter service|building in order|air cargo news direct|new la facility|los angeles international airport|fourth quarter of 2017|space in|in may|by prism realty corporation"
a794b4,series of new european drop points in april|expansion of uld stations|station in sao paulo|year as part of|global peli biothermal clients|major logistics hub for|in frankfurt|latest in|in close proximity|new frankfurt facility|air cargo news direct|crēdo on demand rental program|latest network station|credo line of temperature|more pharma logistics news
92f079,tens of thousands of family wage jobs|sudden crash of hanjin shipping in august last year|failure of one of|procurement of tug services at us ports|wording in section 7.4 of the|concerns of shippers in|safeguards in case of|four-to-one in favour of|consortium of ro-ro shipping lines|service agreement between international car carriers wallenius wilhelmsen logistics|continuity of operations|providers of vessel space|careful analysis of|members of|scope of
f6c863,major freighter order from turkish airlines for three 777 freighters as|cargo fleet with order for three more b777 freighters|maintenance arm of turkish airlines|turkish airlines chairman of|with more than 30 777s in|order of three 777 freighters|first nine months of 2018 on strong passenger|100th anniversary of turkish republic|collaboration with turkish technic|strategic partnership programme in turkey last year|days after turkish airlines|fleet of boeing jetliners|success in recent years as turkey|by turkish president recep tayyip erdo?an during|flag carrier of turkey
